"results.created_at","results.id","results.id_str","results.text","results.source","results.truncated","results.in_reply_to_status_id","results.in_reply_to_status_id_str","results.in_reply_to_user_id","results.in_reply_to_user_id_str","results.in_reply_to_screen_name","results.geo","results.coordinates","results.contributors","results.is_quote_status","results.quote_count","results.reply_count","results.retweet_count","results.favorite_count","results.favorited","results.retweeted","results.filter_level","results.lang","results.quoted_status_id","results.quoted_status_id_str","results.possibly_sensitive","results.user.id","results.user.id_str","results.user.name","results.user.screen_name","results.user.location","results.user.url","results.user.description","results.user.translator_type","results.user.protected","results.user.verified","results.user.followers_count","results.user.friends_count","results.user.listed_count","results.user.favourites_count","results.user.statuses_count","results.user.created_at","results.user.utc_offset","results.user.time_zone","results.user.geo_enabled","results.user.lang","results.user.contributors_enabled","results.user.is_translator","results.user.profile_background_color","results.user.profile_background_image_url","results.user.profile_background_image_url_https","results.user.profile_background_tile","results.user.profile_link_color","results.user.profile_sidebar_border_color","results.user.profile_sidebar_fill_color","results.user.profile_text_color","results.user.profile_use_background_image","results.user.profile_image_url","results.user.profile_image_url_https","results.user.default_profile","results.user.default_profile_image","results.user.following","results.user.follow_request_sent","results.user.notifications","results.user.profile_banner_url","results.place.id","results.place.url","results.place.place_type","results.place.name","results.place.full_name","results.place.country_code","results.place.country","results.place.bounding_box.type","results.retweeted_status.created_at","results.retweeted_status.id","results.retweeted_status.id_str","results.retweeted_status.text","results.retweeted_status.source","results.retweeted_status.truncated","results.retweeted_status.in_reply_to_status_id","results.retweeted_status.in_reply_to_status_id_str","results.retweeted_status.in_reply_to_user_id","results.retweeted_status.in_reply_to_user_id_str","results.retweeted_status.in_reply_to_screen_name","results.retweeted_status.geo","results.retweeted_status.coordinates","results.retweeted_status.contributors","results.retweeted_status.is_quote_status","results.retweeted_status.quote_count","results.retweeted_status.reply_count","results.retweeted_status.retweet_count","results.retweeted_status.favorite_count","results.retweeted_status.favorited","results.retweeted_status.retweeted","results.retweeted_status.possibly_sensitive","results.retweeted_status.filter_level","results.retweeted_status.lang","results.retweeted_status.quoted_status_id","results.retweeted_status.quoted_status_id_str","results.retweeted_status.user.id","results.retweeted_status.user.id_str","results.retweeted_status.user.name","results.retweeted_status.user.screen_name","results.retweeted_status.user.location","results.retweeted_status.user.url","results.retweeted_status.user.description","results.retweeted_status.user.translator_type","results.retweeted_status.user.protected","results.retweeted_status.user.verified","results.retweeted_status.user.followers_count","results.retweeted_status.user.friends_count","results.retweeted_status.user.listed_count","results.retweeted_status.user.favourites_count","results.retweeted_status.user.statuses_count","results.retweeted_status.user.created_at","results.retweeted_status.user.utc_offset","results.retweeted_status.user.time_zone","results.retweeted_status.user.geo_enabled","results.retweeted_status.user.lang","results.retweeted_status.user.contributors_enabled","results.retweeted_status.user.is_translator","results.retweeted_status.user.profile_background_color","results.retweeted_status.user.profile_background_image_url","results.retweeted_status.user.profile_background_image_url_https","results.retweeted_status.user.profile_background_tile","results.retweeted_status.user.profile_link_color","results.retweeted_status.user.profile_sidebar_border_color","results.retweeted_status.user.profile_sidebar_fill_color","results.retweeted_status.user.profile_text_color","results.retweeted_status.user.profile_use_background_image","results.retweeted_status.user.profile_image_url","results.retweeted_status.user.profile_image_url_https","results.retweeted_status.user.profile_banner_url","results.retweeted_status.user.default_profile","results.retweeted_status.user.default_profile_image","results.retweeted_status.user.following","results.retweeted_status.user.follow_request_sent","results.retweeted_status.user.notifications","results.retweeted_status.place.id","results.retweeted_status.place.url","results.retweeted_status.place.place_type","results.retweeted_status.place.name","results.retweeted_status.place.full_name","results.retweeted_status.place.country_code","results.retweeted_status.place.country","results.retweeted_status.place.bounding_box.type","results.retweeted_status.extended_tweet.full_text","results.retweeted_status.quoted_status.created_at","results.retweeted_status.quoted_status.id","results.retweeted_status.quoted_status.id_str","results.retweeted_status.quoted_status.text","results.retweeted_status.quoted_status.source","results.retweeted_status.quoted_status.truncated","results.retweeted_status.quoted_status.in_reply_to_status_id","results.retweeted_status.quoted_status.in_reply_to_status_id_str","results.retweeted_status.quoted_status.in_reply_to_user_id","results.retweeted_status.quoted_status.in_reply_to_user_id_str","results.retweeted_status.quoted_status.in_reply_to_screen_name","results.retweeted_status.quoted_status.geo","results.retweeted_status.quoted_status.coordinates","results.retweeted_status.quoted_status.contributors","results.retweeted_status.quoted_status.is_quote_status","results.retweeted_status.quoted_status.quote_count","results.retweeted_status.quoted_status.reply_count","results.retweeted_status.quoted_status.retweet_count","results.retweeted_status.quoted_status.favorite_count","results.retweeted_status.quoted_status.favorited","results.retweeted_status.quoted_status.retweeted","results.retweeted_status.quoted_status.possibly_sensitive","results.retweeted_status.quoted_status.filter_level","results.retweeted_status.quoted_status.lang","results.retweeted_status.quoted_status.user.id","results.retweeted_status.quoted_status.user.id_str","results.retweeted_status.quoted_status.user.name","results.retweeted_status.quoted_status.user.screen_name","results.retweeted_status.quoted_status.user.location","results.retweeted_status.quoted_status.user.url","results.retweeted_status.quoted_status.user.description","results.retweeted_status.quoted_status.user.translator_type","results.retweeted_status.quoted_status.user.protected","results.retweeted_status.quoted_status.user.verified","results.retweeted_status.quoted_status.user.followers_count","results.retweeted_status.quoted_status.user.friends_count","results.retweeted_status.quoted_status.user.listed_count","results.retweeted_status.quoted_status.user.favourites_count","results.retweeted_status.quoted_status.user.statuses_count","results.retweeted_status.quoted_status.user.created_at","results.retweeted_status.quoted_status.user.utc_offset","results.retweeted_status.quoted_status.user.time_zone","results.retweeted_status.quoted_status.user.geo_enabled","results.retweeted_status.quoted_status.user.lang","results.retweeted_status.quoted_status.user.contributors_enabled","results.retweeted_status.quoted_status.user.is_translator","results.retweeted_status.quoted_status.user.profile_background_color","results.retweeted_status.quoted_status.user.profile_background_image_url","results.retweeted_status.quoted_status.user.profile_background_image_url_https","results.retweeted_status.quoted_status.user.profile_background_tile","results.retweeted_status.quoted_status.user.profile_link_color","results.retweeted_status.quoted_status.user.profile_sidebar_border_color","results.retweeted_status.quoted_status.user.profile_sidebar_fill_color","results.retweeted_status.quoted_status.user.profile_text_color","results.retweeted_status.quoted_status.user.profile_use_background_image","results.retweeted_status.quoted_status.user.profile_image_url","results.retweeted_status.quoted_status.user.profile_image_url_https","results.retweeted_status.quoted_status.user.profile_banner_url","results.retweeted_status.quoted_status.user.default_profile","results.retweeted_status.quoted_status.user.default_profile_image","results.retweeted_status.quoted_status.user.following","results.retweeted_status.quoted_status.user.follow_request_sent","results.retweeted_status.quoted_status.user.notifications","results.retweeted_status.quoted_status.place.id","results.retweeted_status.quoted_status.place.url","results.retweeted_status.quoted_status.place.place_type","results.retweeted_status.quoted_status.place.name","results.retweeted_status.quoted_status.place.full_name","results.retweeted_status.quoted_status.place.country_code","results.retweeted_status.quoted_status.place.country","results.retweeted_status.quoted_status.place.bounding_box.type","results.retweeted_status.quoted_status.extended_tweet.full_text","results.retweeted_status.quoted_status_permalink.url","results.retweeted_status.quoted_status_permalink.expanded","results.retweeted_status.quoted_status_permalink.display","results.quoted_status.created_at","results.quoted_status.id","results.quoted_status.id_str","results.quoted_status.text","results.quoted_status.source","results.quoted_status.truncated","results.quoted_status.in_reply_to_status_id","results.quoted_status.in_reply_to_status_id_str","results.quoted_status.in_reply_to_user_id","results.quoted_status.in_reply_to_user_id_str","results.quoted_status.in_reply_to_screen_name","results.quoted_status.geo","results.quoted_status.coordinates","results.quoted_status.contributors","results.quoted_status.is_quote_status","results.quoted_status.quote_count","results.quoted_status.reply_count","results.quoted_status.retweet_count","results.quoted_status.favorite_count","results.quoted_status.favorited","results.quoted_status.retweeted","results.quoted_status.filter_level","results.quoted_status.lang","results.quoted_status.possibly_sensitive","results.quoted_status.user.id","results.quoted_status.user.id_str","results.quoted_status.user.name","results.quoted_status.user.screen_name","results.quoted_status.user.location","results.quoted_status.user.url","results.quoted_status.user.description","results.quoted_status.user.translator_type","results.quoted_status.user.protected","results.quoted_status.user.verified","results.quoted_status.user.followers_count","results.quoted_status.user.friends_count","results.quoted_status.user.listed_count","results.quoted_status.user.favourites_count","results.quoted_status.user.statuses_count","results.quoted_status.user.created_at","results.quoted_status.user.utc_offset","results.quoted_status.user.time_zone","results.quoted_status.user.geo_enabled","results.quoted_status.user.lang","results.quoted_status.user.contributors_enabled","results.quoted_status.user.is_translator","results.quoted_status.user.profile_background_color","results.quoted_status.user.profile_background_image_url","results.quoted_status.user.profile_background_image_url_https","results.quoted_status.user.profile_background_tile","results.quoted_status.user.profile_link_color","results.quoted_status.user.profile_sidebar_border_color","results.quoted_status.user.profile_sidebar_fill_color","results.quoted_status.user.profile_text_color","results.quoted_status.user.profile_use_background_image","results.quoted_status.user.profile_image_url","results.quoted_status.user.profile_image_url_https","results.quoted_status.user.default_profile","results.quoted_status.user.default_profile_image","results.quoted_status.user.following","results.quoted_status.user.follow_request_sent","results.quoted_status.user.notifications","results.quoted_status.user.profile_banner_url","results.quoted_status.place.id","results.quoted_status.place.url","results.quoted_status.place.place_type","results.quoted_status.place.name","results.quoted_status.place.full_name","results.quoted_status.place.country_code","results.quoted_status.place.country","results.quoted_status.place.bounding_box.type","results.quoted_status.extended_tweet.full_text","results.quoted_status_permalink.url","results.quoted_status_permalink.expanded","results.quoted_status_permalink.display","results.extended_tweet.full_text","next.","requestParameters.maxResults","requestParameters.fromDate","requestParameters.toDate"
"Mon Nov 05 19:36:05 +0000 2018",1059529806600114176,"1059529806600114177","RT @MaxRose4NY: When we started 15 months ago, this race wasn't even on the map. Now, because of all of your hard work, we're heading into…","<a href=""http://twitter.com"" rel=""nofollow"">Twitter Web Client</a>",FALSE,NA,NA,NA,NA,NA,NA,NA,NA,FALSE,0,0,0,0,FALSE,FALSE,"low","en",NA,NA,NA,810145062,"810145062","Mary Lou Dorazio","catlover1943",NA,NA,"Love Pres. Obama, Michelle, Hillary, Dems, Equal rights for all. Love animals, especially cats. #TRUMP NOT MY PRESIDENT. #RESIST, #IMPEACH TRUMP & PENCE","none",FALSE,FALSE,10208,11051,507,169648,386167,"Sat Sep 08 04:08:04 +0000 2012",NA,NA,TRUE,"en",FALSE,FALSE,"000000","http://abs.twimg.com/images/themes/theme4/bg.gif","https://abs.twimg.com/images/themes/theme4/bg.gif",FALSE,"981CEB","000000","000000","000000",FALSE,"http://pbs.twimg.com/profile_images/2594217560/amcl52m9bq037j1i3h58_normal.jpeg","https://pbs.twimg.com/profile_images/2594217560/amcl52m9bq037j1i3h58_normal.jpeg",FALSE,FALSE,NA,NA,NA,NA,NA,NA,NA,NA,NA,NA,NA,NA,"Thu Nov 01 21:37:26 +0000 2018",1058110793210908672,"1058110793210908672","When we started 15 months ago, this race wasn't even on the map. Now, because of all of your hard work, we're headi… https://t.co/n0hX4vlQ8x","<a href=""http://twitter.com/download/iphone"" rel=""nofollow"">Twitter for iPhone</a>",TRUE,NA,NA,NA,NA,NA,NA,NA,NA,FALSE,0,5,65,160,FALSE,FALSE,FALSE,"low","en",NA,NA,892491627088011264,"892491627088011264","Max Rose","MaxRose4NY","Staten Island","http://www.maxroseforcongress.com","The proud Congressman-Elect for #NY11. Staten Islander, veteran, and massive fan of Pitch Perfect.","none",FALSE,TRUE,12467,361,175,294,1654,"Tue Aug 01 21:06:00 +0000 2017",NA,NA,TRUE,"en",FALSE,FALSE,"F5F8FA","","",FALSE,"1DA1F2","C0DEED","DDEEF6","333333",TRUE,"http://pbs.twimg.com/profile_images/1000085807229685760/psTa9av__normal.jpg","https://pbs.twimg.com/profile_images/1000085807229685760/psTa9av__normal.jpg","https://pbs.twimg.com/profile_banners/892491627088011264/1501677969",TRUE,FALSE,NA,NA,NA,NA,NA,NA,NA,NA,NA,NA,NA,"When we started 15 months ago, this race wasn't even on the map. Now, because of all of your hard work, we're heading into GOTV in a dead heat. Thank you all so much for building this movement, now let's knock that extra door, make that extra call to get over the finish line. https://t.co/gX1N6MJCU4",NA,NA,NA,NA,NA,NA,NA,NA,NA,NA,NA,NA,NA,NA,NA,NA,NA,NA,NA,NA,NA,NA,NA,NA,NA,NA,NA,NA,NA,NA,NA,NA,NA,NA,NA,NA,NA,NA,NA,NA,NA,NA,NA,NA,NA,NA,NA,NA,NA,NA,NA,NA,NA,NA,NA,NA,NA,NA,NA,NA,NA,NA,NA,NA,NA,NA,NA,NA,NA,NA,NA,NA,NA,NA,NA,NA,NA,NA,NA,NA,NA,NA,NA,NA,NA,NA,NA,NA,NA,NA,NA,NA,NA,NA,NA,NA,NA,NA,NA,NA,NA,NA,NA,NA,NA,NA,NA,NA,NA,NA,NA,NA,NA,NA,NA,NA,NA,NA,NA,NA,NA,NA,NA,NA,NA,NA,NA,NA,NA,NA,NA,NA,NA,NA,NA,NA,NA,NA,NA,NA,NA,NA,NA,NA,NA,NA,NA,NA,NA,NA,NA,"eyJhdXRoZW50aWNpdHkiOiJkZmFmOTE5YzdiN2M4NWE5YzM0OTIwYmQzOWEzYmU5NmNhMjczNTE3NTVhM2FiNjJmMDMzYmRlZThlYTVjNDc0IiwiZnJvbURhdGUiOiIyMDE4MTEwNTAwMDAiLCJ0b0RhdGUiOiIyMDE4MTExOTAwMDAiLCJuZXh0IjoiMjAxODExMDUxNzU2MTAtMTA1OTUwNDY2MTQyODkyNDQxNS0wIn0=",100,"201811050000","201811190000"
"Mon Nov 05 19:34:55 +0000 2018",1059529510645874688,"1059529510645874689","RT @MaxRose4NY: If you think your vote doesn’t matter, listen to this message from Shelly Simonds, who lost her election to a coin toss. Th…","<a href=""http://twitter.com"" rel=""nofollow"">Twitter Web Client</a>",FALSE,NA,NA,NA,NA,NA,NA,NA,NA,FALSE,0,0,0,0,FALSE,FALSE,"low","en",NA,NA,NA,810145062,"810145062","Mary Lou Dorazio","catlover1943",NA,NA,"Love Pres. Obama, Michelle, Hillary, Dems, Equal rights for all. Love animals, especially cats. #TRUMP NOT MY PRESIDENT. #RESIST, #IMPEACH TRUMP & PENCE","none",FALSE,FALSE,10208,11051,507,169648,386167,"Sat Sep 08 04:08:04 +0000 2012",NA,NA,TRUE,"en",FALSE,FALSE,"000000","http://abs.twimg.com/images/themes/theme4/bg.gif","https://abs.twimg.com/images/themes/theme4/bg.gif",FALSE,"981CEB","000000","000000","000000",FALSE,"http://pbs.twimg.com/profile_images/2594217560/amcl52m9bq037j1i3h58_normal.jpeg","https://pbs.twimg.com/profile_images/2594217560/amcl52m9bq037j1i3h58_normal.jpeg",FALSE,FALSE,NA,NA,NA,NA,NA,NA,NA,NA,NA,NA,NA,NA,"Sun Nov 04 15:45:33 +0000 2018",1059109403532640256,"1059109403532640260","If you think your vote doesn’t matter, listen to this message from Shelly Simonds, who lost her election to a coin… https://t.co/tm3kJH3q08","<a href=""http://twitter.com/download/iphone"" rel=""nofollow"">Twitter for iPhone</a>",TRUE,NA,NA,NA,NA,NA,NA,NA,NA,FALSE,0,4,101,189,FALSE,FALSE,FALSE,"low","en",NA,NA,892491627088011264,"892491627088011264","Max Rose","MaxRose4NY","Staten Island","http://www.maxroseforcongress.com","The proud Congressman-Elect for #NY11. Staten Islander, veteran, and massive fan of Pitch Perfect.","none",FALSE,TRUE,12467,361,175,294,1654,"Tue Aug 01 21:06:00 +0000 2017",NA,NA,TRUE,"en",FALSE,FALSE,"F5F8FA","","",FALSE,"1DA1F2","C0DEED","DDEEF6","333333",TRUE,"http://pbs.twimg.com/profile_images/1000085807229685760/psTa9av__normal.jpg","https://pbs.twimg.com/profile_images/1000085807229685760/psTa9av__normal.jpg","https://pbs.twimg.com/profile_banners/892491627088011264/1501677969",TRUE,FALSE,NA,NA,NA,NA,NA,NA,NA,NA,NA,NA,NA,"If you think your vote doesn’t matter, listen to this message from Shelly Simonds, who lost her election to a coin toss. This race is a dead heat, and your vote can be the one that decides this election. https://t.co/OBtymBk1Bf",NA,NA,NA,NA,NA,NA,NA,NA,NA,NA,NA,NA,NA,NA,NA,NA,NA,NA,NA,NA,NA,NA,NA,NA,NA,NA,NA,NA,NA,NA,NA,NA,NA,NA,NA,NA,NA,NA,NA,NA,NA,NA,NA,NA,NA,NA,NA,NA,NA,NA,NA,NA,NA,NA,NA,NA,NA,NA,NA,NA,NA,NA,NA,NA,NA,NA,NA,NA,NA,NA,NA,NA,NA,NA,NA,NA,NA,NA,NA,NA,NA,NA,NA,NA,NA,NA,NA,NA,NA,NA,NA,NA,NA,NA,NA,NA,NA,NA,NA,NA,NA,NA,NA,NA,NA,NA,NA,NA,NA,NA,NA,NA,NA,NA,NA,NA,NA,NA,NA,NA,NA,NA,NA,NA,NA,NA,NA,NA,NA,NA,NA,NA,NA,NA,NA,NA,NA,NA,NA,NA,NA,NA,NA,NA,NA,NA,NA,NA,NA,NA,NA,"eyJhdXRoZW50aWNpdHkiOiJkZmFmOTE5YzdiN2M4NWE5YzM0OTIwYmQzOWEzYmU5NmNhMjczNTE3NTVhM2FiNjJmMDMzYmRlZThlYTVjNDc0IiwiZnJvbURhdGUiOiIyMDE4MTEwNTAwMDAiLCJ0b0RhdGUiOiIyMDE4MTExOTAwMDAiLCJuZXh0IjoiMjAxODExMDUxNzU2MTAtMTA1OTUwNDY2MTQyODkyNDQxNS0wIn0=",100,"201811050000","201811190000"
"Mon Nov 05 19:34:33 +0000 2018",1059529420686483456,"1059529420686483457","RT @nynursesunited: .@MaxRose4NY for Congress- He has a keen awareness of the health care needs our district and will fight to preserve fun…","<a href=""http://twitter.com"" rel=""nofollow"">Twitter Web Client</a>",FALSE,NA,NA,NA,NA,NA,NA,NA,NA,FALSE,0,0,0,0,FALSE,FALSE,"low","en",NA,NA,NA,810145062,"810145062","Mary Lou Dorazio","catlover1943",NA,NA,"Love Pres. Obama, Michelle, Hillary, Dems, Equal rights for all. Love animals, especially cats. #TRUMP NOT MY PRESIDENT. #RESIST, #IMPEACH TRUMP & PENCE","none",FALSE,FALSE,10208,11051,507,169648,386167,"Sat Sep 08 04:08:04 +0000 2012",NA,NA,TRUE,"en",FALSE,FALSE,"000000","http://abs.twimg.com/images/themes/theme4/bg.gif","https://abs.twimg.com/images/themes/theme4/bg.gif",FALSE,"981CEB","000000","000000","000000",FALSE,"http://pbs.twimg.com/profile_images/2594217560/amcl52m9bq037j1i3h58_normal.jpeg","https://pbs.twimg.com/profile_images/2594217560/amcl52m9bq037j1i3h58_normal.jpeg",FALSE,FALSE,NA,NA,NA,NA,NA,NA,NA,NA,NA,NA,NA,NA,"Sun Nov 04 20:00:14 +0000 2018",1059173494435528704,"1059173494435528707",".@MaxRose4NY for Congress- He has a keen awareness of the health care needs our district and will fight to preserve… https://t.co/HqIhMKhuf1","<a href=""http://twitter.com/download/android"" rel=""nofollow"">Twitter for Android</a>",TRUE,NA,NA,NA,NA,NA,NA,NA,NA,FALSE,0,1,26,71,FALSE,FALSE,FALSE,"low","en",NA,NA,33133796,"33133796","Pat Kane","nynursesunited","New York",NA,"CT OR nurse & elected leader of @nynurses fighting for #SafeStaffing. Tweets are my own.","none",FALSE,FALSE,846,700,16,3848,5673,"Sun Apr 19 04:53:24 +0000 2009",NA,NA,TRUE,"en",FALSE,FALSE,"BADFCD","http://abs.twimg.com/images/themes/theme12/bg.gif","https://abs.twimg.com/images/themes/theme12/bg.gif",FALSE,"FF0000","F2E195","FFF7CC","0C3E53",TRUE,"http://pbs.twimg.com/profile_images/517061020515598336/TBZvDyiq_normal.jpeg","https://pbs.twimg.com/profile_images/517061020515598336/TBZvDyiq_normal.jpeg","https://pbs.twimg.com/profile_banners/33133796/1356741634",FALSE,FALSE,NA,NA,NA,NA,NA,NA,NA,NA,NA,NA,NA,".@MaxRose4NY for Congress- He has a keen awareness of the health care needs our district and will fight to preserve funding. Max is committed to defending nurses on the job and in our practice so that we can provide the care our communities deserve.
#GOTV #GoMax #BlueWave https://t.co/lcH0F8wKZE",NA,NA,NA,NA,NA,NA,NA,NA,NA,NA,NA,NA,NA,NA,NA,NA,NA,NA,NA,NA,NA,NA,NA,NA,NA,NA,NA,NA,NA,NA,NA,NA,NA,NA,NA,NA,NA,NA,NA,NA,NA,NA,NA,NA,NA,NA,NA,NA,NA,NA,NA,NA,NA,NA,NA,NA,NA,NA,NA,NA,NA,NA,NA,NA,NA,NA,NA,NA,NA,NA,NA,NA,NA,NA,NA,NA,NA,NA,NA,NA,NA,NA,NA,NA,NA,NA,NA,NA,NA,NA,NA,NA,NA,NA,NA,NA,NA,NA,NA,NA,NA,NA,NA,NA,NA,NA,NA,NA,NA,NA,NA,NA,NA,NA,NA,NA,NA,NA,NA,NA,NA,NA,NA,NA,NA,NA,NA,NA,NA,NA,NA,NA,NA,NA,NA,NA,NA,NA,NA,NA,NA,NA,NA,NA,NA,NA,NA,NA,NA,NA,NA,"eyJhdXRoZW50aWNpdHkiOiJkZmFmOTE5YzdiN2M4NWE5YzM0OTIwYmQzOWEzYmU5NmNhMjczNTE3NTVhM2FiNjJmMDMzYmRlZThlYTVjNDc0IiwiZnJvbURhdGUiOiIyMDE4MTEwNTAwMDAiLCJ0b0RhdGUiOiIyMDE4MTExOTAwMDAiLCJuZXh0IjoiMjAxODExMDUxNzU2MTAtMTA1OTUwNDY2MTQyODkyNDQxNS0wIn0=",100,"201811050000","201811190000"
"Mon Nov 05 19:34:22 +0000 2018",1059529372607172608,"1059529372607172608","RT @MaxRose4NY: Couldn't make it to a GOTV shift? No problem, you can still help us spread the word by sharing this on your social media an…","<a href=""http://twitter.com"" rel=""nofollow"">Twitter Web Client</a>",FALSE,NA,NA,NA,NA,NA,NA,NA,NA,FALSE,0,0,0,0,FALSE,FALSE,"low","en",NA,NA,NA,810145062,"810145062","Mary Lou Dorazio","catlover1943",NA,NA,"Love Pres. Obama, Michelle, Hillary, Dems, Equal rights for all. Love animals, especially cats. #TRUMP NOT MY PRESIDENT. #RESIST, #IMPEACH TRUMP & PENCE","none",FALSE,FALSE,10208,11051,507,169648,386167,"Sat Sep 08 04:08:04 +0000 2012",NA,NA,TRUE,"en",FALSE,FALSE,"000000","http://abs.twimg.com/images/themes/theme4/bg.gif","https://abs.twimg.com/images/themes/theme4/bg.gif",FALSE,"981CEB","000000","000000","000000",FALSE,"http://pbs.twimg.com/profile_images/2594217560/amcl52m9bq037j1i3h58_normal.jpeg","https://pbs.twimg.com/profile_images/2594217560/amcl52m9bq037j1i3h58_normal.jpeg",FALSE,FALSE,NA,NA,NA,NA,NA,NA,NA,NA,NA,NA,NA,NA,"Sun Nov 04 20:44:49 +0000 2018",1059184715905810432,"1059184715905810432","Couldn't make it to a GOTV shift? No problem, you can still help us spread the word by sharing this on your social… https://t.co/R8wHrXTaTK","<a href=""http://twitter.com/download/iphone"" rel=""nofollow"">Twitter for iPhone</a>",TRUE,NA,NA,NA,NA,NA,NA,NA,NA,FALSE,0,3,71,99,FALSE,FALSE,FALSE,"low","en",NA,NA,892491627088011264,"892491627088011264","Max Rose","MaxRose4NY","Staten Island","http://www.maxroseforcongress.com","The proud Congressman-Elect for #NY11. Staten Islander, veteran, and massive fan of Pitch Perfect.","none",FALSE,TRUE,12467,361,175,294,1654,"Tue Aug 01 21:06:00 +0000 2017",NA,NA,TRUE,"en",FALSE,FALSE,"F5F8FA","","",FALSE,"1DA1F2","C0DEED","DDEEF6","333333",TRUE,"http://pbs.twimg.com/profile_images/1000085807229685760/psTa9av__normal.jpg","https://pbs.twimg.com/profile_images/1000085807229685760/psTa9av__normal.jpg","https://pbs.twimg.com/profile_banners/892491627088011264/1501677969",TRUE,FALSE,NA,NA,NA,NA,NA,NA,NA,NA,NA,NA,NA,"Couldn't make it to a GOTV shift? No problem, you can still help us spread the word by sharing this on your social media and telling all your friends to get to the polls on Tuesday! https://t.co/PpUs0mmTkH",NA,NA,NA,NA,NA,NA,NA,NA,NA,NA,NA,NA,NA,NA,NA,NA,NA,NA,NA,NA,NA,NA,NA,NA,NA,NA,NA,NA,NA,NA,NA,NA,NA,NA,NA,NA,NA,NA,NA,NA,NA,NA,NA,NA,NA,NA,NA,NA,NA,NA,NA,NA,NA,NA,NA,NA,NA,NA,NA,NA,NA,NA,NA,NA,NA,NA,NA,NA,NA,NA,NA,NA,NA,NA,NA,NA,NA,NA,NA,NA,NA,NA,NA,NA,NA,NA,NA,NA,NA,NA,NA,NA,NA,NA,NA,NA,NA,NA,NA,NA,NA,NA,NA,NA,NA,NA,NA,NA,NA,NA,NA,NA,NA,NA,NA,NA,NA,NA,NA,NA,NA,NA,NA,NA,NA,NA,NA,NA,NA,NA,NA,NA,NA,NA,NA,NA,NA,NA,NA,NA,NA,NA,NA,NA,NA,NA,NA,NA,NA,NA,NA,"eyJhdXRoZW50aWNpdHkiOiJkZmFmOTE5YzdiN2M4NWE5YzM0OTIwYmQzOWEzYmU5NmNhMjczNTE3NTVhM2FiNjJmMDMzYmRlZThlYTVjNDc0IiwiZnJvbURhdGUiOiIyMDE4MTEwNTAwMDAiLCJ0b0RhdGUiOiIyMDE4MTExOTAwMDAiLCJuZXh0IjoiMjAxODExMDUxNzU2MTAtMTA1OTUwNDY2MTQyODkyNDQxNS0wIn0=",100,"201811050000","201811190000"
